{
  "$schema": "https://json-schema.org/draft/2020-12/schema",
  "$id": "https://schemas.mm-chat.invalid/parser/parser-protocol-request-header.v1.schema.json",
  "title": "MM Chat parser protocol request header v1",
  "description": "Closed JCS header for one offline parser invocation. Frame validation separately proves canonical JCS bytes, body length, and requestBindingHash.",
  "type": "object",
  "additionalProperties": false,
  "required": [
    "invocationId",
    "parserConfigHash",
    "expectedSourceBytes",
    "expectedSourceSha256",
    "requestBindingHash",
    "deadlineUnixMillis",
    "maxResultBytes"
  ],
  "properties": {
    "invocationId": {
      "type": "string",
      "minLength": 1,
      "maxLength": 128,
      "pattern": "^[A-Za-z0-9][A-Za-z0-9._:-]{0,127}$"
    },
    "declaredMime": {
      "type": "string",
      "minLength": 3,
      "maxLength": 255,
      "pattern": "^[a-z0-9][a-z0-9!#$&^_.+-]*/[a-z0-9][a-z0-9!#$&^_.+-]*$"
    },
    "declaredExtension": {
      "type": "string",
      "minLength": 2,
      "maxLength": 32,
      "pattern": "^\\.[a-z0-9][a-z0-9._+-]*$"
    },
    "parserConfigHash": {
      "$ref": "canonical-common.v1.schema.json#/$defs/sha256"
    },
    "expectedSourceBytes": {
      "type": "integer",
      "minimum": 0,
      "maximum": 52428800
    },
    "expectedSourceSha256": {
      "$ref": "canonical-common.v1.schema.json#/$defs/sha256"
    },
    "requestBindingHash": {
      "$ref": "canonical-common.v1.schema.json#/$defs/sha256"
    },
    "deadlineUnixMillis": {
      "$ref": "canonical-common.v1.schema.json#/$defs/nonNegativeSafeInteger"
    },
    "maxResultBytes": {
      "type": "integer",
      "minimum": 1,
      "maximum": 67108864
    }
  }
}
