{"deadlineUnixMillis":0,"declaredExtension":".txt","declaredMime":"text/plain","expectedSourceBytes":0,"expectedSourceSha256":"0000000000000000000000000000000000000000000000000000000000000000","invocationId":"x","maxResultBytes":1,"parserConfigHash":"0000000000000000000000000000000000000000000000000000000000000000","requestBindingHash":"0000000000000000000000000000000000000000000000000000000000000000"}